Job Role,Required Skills
AI Engineer,"Python, Machine Learning, Deep Learning, TensorFlow, PyTorch, Data Science"
Machine Learning Engineer,"Python, Machine Learning, Scikit-Learn, Statistics, Data Science, TensorFlow"
Data Scientist,"Python, SQL, Pandas, NumPy, Statistics, Machine Learning"
Data Analyst,"SQL, Excel, Power BI, Tableau, Data Analysis, Python"
Python Developer,"Python, Django, Flask, SQL, Git, REST API"
Backend Developer,"Python, Django, Flask, REST API, SQL, Docker"
Full Stack Developer,"Python, JavaScript, Django, Flask, SQL, Git, HTML, CSS"
NLP Engineer,"Python, NLP, TensorFlow, PyTorch, Machine Learning, Text Processing"
Computer Vision Engineer,"Python, Computer Vision, OpenCV, Deep Learning, TensorFlow, PyTorch"
Software Engineer,"Python, Git, REST API, SQL, Algorithms, Object-Oriented Programming"
DevOps Engineer,"Docker, Git, CI/CD, AWS, Linux, Python"
Cloud Engineer,"AWS, Docker, Kubernetes, Python, DevOps, Cloud Architecture"
Business Analyst,"Excel, SQL, Power BI, Communication, Data Analysis, Stakeholder Management"
BI Developer,"Power BI, SQL, Excel, Data Visualization, Data Modeling, DAX"
Data Engineer,"Python, SQL, ETL, Hadoop, Spark, Data Warehousing"
Frontend Developer,"HTML, CSS, JavaScript, React, Bootstrap, Responsive Design"
QA Engineer,"Python, Automation, Selenium, Test Plans, Git, CI/CD"
Product Manager,"Communication, Agile, Roadmapping, Stakeholder Engagement, Analytics"
Security Analyst,"Security, Python, Network Monitoring, Risk Management, Compliance"
Research Engineer,"Python, Machine Learning, Data Science, Research, Statistics"
